{
  "raw_record_id": "f94cda6a723fe7bf832e6557669d58120644922323cc6d641cd2cd7f85482086",
  "schema_version": "raw-envelope-v1",
  "source_file": "A20240626.1400+0700-20240626.1401+0700_840_ebs",
  "source_line": 1,
  "raw_payload": "l_service_request;success;125;0;normal;84000000000;452040000000001;1000000001;3500000000000001;32772;76;19012;230487040;10.0.0.10;;nas;;;v-internet,ims;5,6;10.0.0.20,2001:db8::20,198.51.100.20;203.0.113.53,203.0.113.54;;;;;;;;;;;NODE01;12063;;;;;;;;;;;;;;;1719385773350;;;2024-06-26-14"
}